amatiage-givenchy-type,Amarige (Givenchy) type,Amarige (Givenchy) Type,Orange Blossom; Peach; Plum; Neroli; Brazilian Rosewood; Violet; Mandarin Orange,Tuberose; Mimosa; Gardenia; Ylang-Ylang; Jasmine; Black locust; Carnation; Black Currant; Red Berries; Rose; Cassia; Orchid;,Sandalwood; Amber; Woody Notes; Vanilla; Musk; Tonka Bean; Cedar,Floral,women,,,,yes,,https://justmyscent.online/products/amatiage-givenchy-type,quiz-ready,
alien-goddess-thierry-muglar-type,Alien Goddess (Thierry Muglar) type,Alien Goddess (Thierry Muglar) Type,Coconut Water; Bergamot,Jasmine; Heliotrope,Bourbon Vanilla; Cashmeran,Oriental Floral,women,,,,yes,,https://justmyscent.online/products/alien-goddess-thierry-muglar-type,quiz-ready,
acqua-di-gioia-g-armani-type,Acqua Di Gioia ( G. Armani) -type,Acqua Di Gioia ( G. Armani) Type,Amalfi Lemon; Mint,Water Jasmine,Virginia Cedar; Brown sugar; French labdanum,Floral Aquatic,women,,,,yes,,https://justmyscent.online/products/acqua-di-gioia-g-armani-type,quiz-ready,
acqua-di-gio-g-armani-type,Acqua Di Gio (G. Armani) type,Acqua Di Gio (G. Armani) Type,Lime; Lemon; Bergamot; Jasmine; Orange; Mandarin Orange; Neroli;,Sea Notes; Jasmine; Calone; Rosemary; Peach; Freesia; Hiacynth; Cyclamen; Violet; Coriander; Rose; Nutmeg; Mignonette,White Musk; Cedar; Oakmoss; Patchouli; Amber.,Aromatic Aquatic,men,,,,yes,,https://justmyscent.online/products/acqua-di-gio-g-armani-type,quiz-ready,
a-touch-of-pink-lacoste,A Touch of Pink (LaCoste) type,A Touch of Pink (LaCoste) Type,B lood orange; coriander leaf; cardamom; peach; followed by jasmine; unexpected carrot; spicy coriander. The woodsy-musk base is softened with vanilla Suggestive: Touch of Pink is fragrance aimed at younger audience.,,,,women,,,,no,heartNotes; baseNotes; scentFamily,https://justmyscent.online/products/a-touch-of-pink-lacoste,needs-owner-review,
1-million-elixer-paco-rabanne-type,1 Million Elixer (Paco Rabanne) type,1 Million Elixer (Paco Rabanne) Type,Apple; Davana;,Damask Rose; Cedar; Osmanthus,Vanilla Absolute; Tonka Bean; Patchouli,Woody Aromatic,men,,,,yes,,https://justmyscent.online/products/1-million-elixer-paco-rabanne-type,quiz-ready,
212-c-herrera-type-1,212 (C.Herrera) type,212 (C.Herrera) Type,Orange Blossom; Cactus Flower; Bergamot; Mandarin Orange,Lily; Freesia; Gardenia; Jasmine; Lily-of-the-Valley; White Camelia; Rose; Peony,Musk; Sandalwood.,Floral Woody Musk,women,,,,yes,,https://justmyscent.online/products/212-c-herrera-type-1,quiz-ready,
212-c-herrera-type,212 (C. Herrera) Men,212 (C. Herrera) Men,,,,Woody Floral Musk,men,,,,no,topNotes; heartNotes; baseNotes,https://justmyscent.online/products/212-c-herrera-type,needs-owner-review,
